channelTitle,VideoTitle,channelViewCount,subscriberCount,videoCount,VideoViewCount,likeCount,dislikeCount,commentCount,description
Diamond Platnumz,"Quarantine - Wasafi Feat Diamond Platnumz, Rayvanny, Mbosso, Lava Lava, Queen Darleen &amp; Zuchu",153794517,686000,205,13232684,135237,12108,14389,Do You Think Your Quarantine Moves Are Better Than Us? Show Us Your Quarantine Moves! Audio Produced By S2Kizzy Video Shot and Directed By Director ...
Chloe Ting,Get SNATCHED during Quarantine | Before After Chloe Ting Challenge Results 🔥,6801612074,16700000,2563,5556740,202062,1292,8229,Here are some before after transformation journeys of #chloetingchallenge community people doing the workouts and how their going. I hope everyone is ...
Little Big Toys,Bug&#39;s Quarantine TikTok Videos,2675353765,9050000,2138,4303706,50272,5955,,"Bug have been spending a lot of time doing tiktok videos, here are some of our favorite videos during this quarantine :)"
Trinity and Beyond,Hello Neighbor Steals Our Quarantine Games!!! We Challenge Him!,1231898562,6810000,497,4003174,41728,3786,,Hello Neighbor in Real Life Steals Our Play at Home Quarantine Games!!! Subscribe to Madison and Beyond: http://tinyurl.com/madisonsub Subscribe to Trinity ...
SNOWTHAPRODUCT,Snow Tha Product - NoWhere To Go (QUARANTINE LOVE) (Official Music Video),793383066,6220000,820,2722009,82323,1638,10731,"Since everyone is quarantined in the house because of corona, figured i would drink actual corona, and some 1942 and make a lil challenge for myself.. made ..."
Renz Lesaca,30 Days HOME QUARANTINE push-ups challenge epic transformation,7485786723,4070000,3253,2691865,34197,1659,1375,"Hi there, im Renz lesaca Because of the corona virus outbreak some places in the philippines are under in Enhance Community Quarantine (ECQ) specialy ..."
The Bee Family,FORTNITE DANCE CHALLENGE IN REAL LIFE!! - Quarantine Edition,1129270390,6300000,397,2432350,52055,5277,3190,Bringing back the Fortnite Dance Challenge to help you move and have fun at home! Join The Family! ▻ http://bit.ly/ehbeefamily We Have A Video Game!
Walker Bryant,LAST TO Leave The Self Quarantine WINS w/ My CRUSH **Epic CHALLENGE** ❤️😷| Walker Bryant,109794458,2270000,182,2271760,51549,1556,,"Hey guys its Walker Bryant, also known as Piper Rockelle's crush. Sit back and enjoy watching last to leave the self quarantine wins, with my crush epic ..."
Viralbollywood,Jannat Zubair and Ayaan Zubair FUNNIEST and CUTEST Video during Home Quarantine,109653117,1100000,89,2234412,27872,1893,406,WATCH Jannat Zubair and Ayaan Zubair FUNNIEST and CUTEST Video during Home Quarantine Company: ViralBollywood Entertainment Private Limited ...
W2SPlays,194 RATED FUT DRAFT QUARANTINE CHALLENGE - FIFA 20,1436860304,15900000,296,2127570,62107,2384,2451,W2S 194 RATED FUT DRAFT CHALLENGE My Instagram: http://instagram.com/wroetoshaw My Twitter: http://twitter.com/wroetoshaw SIDEMEN Clothing: ...
Good Mythical Morning,Nasty Condiment War Challenge (Quarantine Episode),652036927,1950000,782,1843528,69932,588,3968,"In this first ever remote episode of Good Mythical Morning, we're playing War and the loser has to eat nasty condiments found in their fridge! GMM #1720 Submit ..."
Michael and Ali Hoffman,Quarantine Challenge 2K20,2444966148,6680000,4589,1826807,31595,447,0,"When the times seem a little dark it's just a call to be more LIGHT! Let your joy fly, crank the tunes and dance in the kitchen! Song: Hold my hand Artist: Jess ..."
Papa Jake,24 Hour Quarantine Box Fort Shelter Challenge!,2793744,11800,15,1803131,89380,1729,8493,24 Hour Quarantine Box Fort Shelter! Today papa jake and logan two brothers build a cardboard quarantiner box fort to survive in for 24 hours. this box fort ...
Kerimcan Durmaz,YOGA CHALLENGE! | QUARANTINE DAYS | #DAY15,220072411,1610000,1004,1583741,79747,3266,6425,"Hey bitch! Karantina'nın 15. gününde Yoga Challenge videosu çektik. Hatta çektiğimizi zannettik, ortaya böyle birşey çıktı. İyi seyirler:) IF YOU LIKE THIS VIDEO, ..."
Norris Nuts Gaming,WHICH NORRIS NUT BUILDS THE BEST QUARANTINE HOUSE? Roblox Challenge Gaming w/ The Norris Nuts,18191338,326000,60,1492737,33141,780,10870,We competed to build each other a quarantine house in Roblox - see who won! Watch next LAST TO LEAVE BED https://youtu.be/HTI8_iMbljI LAST TO LEAVE ...
HobbyFamilyTV,Stay Home With Us CHALLENGE in Minecraft Quarantine! HobbyPig vs HobbyDad,21412714,261000,56,1444775,3004,158,330,"stayhome #challenge #stayhomewithus #minecraft Can we survive the QUARANTINE? Find out Minecraft style. Parents, ▻ Buy shirts and gifts here ..."
Papa Jake,Fallout Box Fort THE MOVIE! 24 Hour Quarantine Shelter Challenge,221688197,2440000,287,1366868,40284,865,2737,Fallout Box Fort THE MOVIE! 24 Hour Quarantine Shelter Challenge 24 Hour Quarantine Box Fort NOOB Vs PRO Shelter Challenge! 24 Hour Quarantine Box ...
Piper Rockelle,Different Types of GIRLFRIENDS during Quarantine **Relatable Couples** 😷❤️| Piper Rockelle,8382305,98200,128,1211210,61223,1624,,Shalom bbys it's Piper Rockelle! Hope your day is great but better watching different types of girlfriends during quarantine relatable couples. Today my crush ...
Doxie Din - not just a dachshund,Quarantine ART Challenge! Cute &amp; funny dachshund dog video!,65792246,836000,57,1133978,7381,1131,577,"There are a lot of different ways to spend quarantine... Like my parents - to sleep until late and then be like couch potatoes all day; or like me to get up early, work ..."
Lev Cameron,WE TURNED OUR BACKYARD INTO A REAL WATERPARK FOR 24 HOURS **Quarantine Vlog 3** 🌊👙 | Lev Cameron,2063290727,4320000,28331,1114600,53005,1520,,Hey guys it's Lev Cameron Piper Rockelle's Crush. Sit back and enjoy watching we turned our backyard into a water park for a 24 hour challenge. In this 24 hour ...
Lev Cameron,INSTAGRAM Followers Control My Quarantine DATE With My CRUSH **Kissing Challenge**💋|Lev Cameron,59204456,597000,101,1104711,46126,1423,4986,Hey guys it's Lev Cameron Piper Rockelle's Crush. Sit back and enjoy watching instagram followers control my quarantine date kiss challenge. Thats right guys ...
Madison and Beyond,Disney Descendants III 3 Marker Challenge!!! Fun Quarantine Ideas for Kids!,172227816,1200000,94,1042060,16654,1066,,Disney Descendants 3 Three Marker Coloring Challenge! Subscribe: https://tinyurl.com/madisonsub Watch our Newest Videos: ...
Papa Jake,24 Hour Quarantine Box Fort NOOB Vs PRO Shelter Challenge!,3093484218,6130000,1030,953479,44455,920,4493,24 Hour Quarantine Box Fort NOOB Vs PRO Shelter Challenge! 24 Hour Quarantine Box Fort Shelter! Today papa jake and logan two brothers build a ...
Ashi Khanna,QUARANTINE PHOTOSHOOT CHALLENGE! (Colour themes) | Ashi Khanna,12554717,363000,26,911272,62655,773,6149,"Hey guys! So as you all know we all are stuck at our homes, and there's no way we can create content together... or maybe WE CAN So i called up Aashna, ..."
SmellyBellyTV,LAST TO LEAVE QUARANTINE CHALLENGE IN OUR ROOMS!!,80530524,978000,174,892324,15037,424,,"We decided to have some fun today and we are all quarantined in our rooms, and the last to leave wins!! The last person to leave must be a servant for 24 hrs!"
Holly Dolke,Day 1: BURN LOWER BELLY FAT (Home Workout Challenge),125920496,1280000,260,820386,32359,181,2440,DO THE FREE QUIZ TO SEE THE BEST PROGRAM FOR YOU HERE: https://bit.ly/3lBZHKC ♡ GET YOUR 30 DAY MEAL PLAN HERE: ...
Emily and Evelyn,LAST TO LEAVE THE QUARANTINE WINS MYSTERY PRICE!!! | Emily and Evelyn,243210735,803000,175,814732,21319,1189,,LAST TO LEAVE THE QUARANTINE WINS MYSTERY PRICE!!! | Emily and Evelyn We have to eliminate each other to win what's in the mystery box! ♡ Please ...
Nastya Nass,Quarantine Twerk Challenge / Nastya Nass/ CORONA VIRUS,218923625,883000,864,790394,30497,541,1047,
Teentigada,Quarantine Takeover Challenge - Teentigada | Sameeksha Sud | Vishal Pandey | Bhavin Bhanushali,79339809,965000,295,643315,46416,900,3119,Hey guys Hope you all are safe & keeping well with the lockdown Here's yet another challenge video for you: Quarantine Takeover challenge. Watch the ...
Thinknoodles,GLOBAL PANDEMIC QUARANTINE CHALLENGE! | 60 Seconds Reatomized,89611508,1420000,61,593209,15343,338,2346,60 Seconds Atomic Adventure Reatomized Survival Game where I try to survive with social distancing all alone!! ➡ Let's GO 6000000 subs! Subscribe now!
WORLDSTARHIPHOP,NLE Choppa Starts The #WorldStarQuarantine Challenge,239944113,2440000,148,524791,18118,400,984,"NLE Choppa Starts The #WorldStarQuarantine Challenge and challenges IDK, Yo Gotti, Blocboy JB & YFN Lucci! Subscribe: http://bit.ly/subWSHH | WSHH ..."
BETZMANN VLOGS,COOKING CHALLENGE | QUARANTINE GAMES | DAY 5,16918163080,24400000,5353,499217,21685,242,926,"DAY 5 IN QUARANTINE, WE ARE HUNGRY ! SO WE DECIDED TO COOK! ARE WE GOOD OR ARE WE GOING TO FAIL? WHICH TEAM IS GOING TO WIN?"
Improvement Pill,The Quarantine Challenge,2421136184,4530000,17653,453651,27862,402,1489,"Sponsored By Audible: Go to http://www.audible.com/improvementpill or text improvementpill to 500 500 to get one free audiobook, 2 free Audible originals and ..."
The Infographics Show,Life Inside Quarantine || CHALLENGE,2202413,14900,15,434573,13675,445,1603,"Life inside quarantine can be difficult, especially if you are separated from your loved ones by a thin plastic sheet, but it's the safest way to control a spreading ..."
MortaL,This QUARANTINE I took the Clash Royale Challenge Ft. @CWA Mobile Gaming ie- Clash With Ash,1120453203,4310000,687,431894,32994,627,941,"One of the best collabs with someone whom I used to admire as a Clash Royale player.. MortalArmy, If you haven't already, start playing Clash Royale this ..."
Play with MEA,Eva and Modi Fun Quarantine Challenge Game | ايفا ومودي المرح في المنزل لعبة التحدي الحجر الصحي,445516821,1750000,228,430596,1452,674,0,ُEva and Modi show a fun game to play at home during quarantine. تظهر ايفا ومودي لعبة ممتعة للعب في المنزل أثناء الحجر الصحي. Subscribe to Play With MEA: ...
Sanket Mehta,Quarantine photoshoot challenge | EP 2 | ft Mr.mnv &amp; Rishabh | Sanket Mehta,1366705656,3250000,1434,411484,39967,173,2008,If you loved this DIY concept and if you're trying this concept upload it on instagram and tag don't forget to mention me in your post @sankett25 insta handles ...
NIKI DEMAR,i tried a &quot;virtual&quot; facetime photoshoot during quarantine,116604541,1270000,79,403355,24409,293,2258,"during this quarantine, i wanted try this photography challenge to test the idea of a facetime photoshoot. in this video, I try 3 locations with 3 different looks to see ..."
BETZMANN VLOGS,MOST LIKELY CHALLENGE | QUARANTINE GAMES | DAY 1,2530973767,9160000,834,402257,18425,300,1031,"LAHORE IS UNDER LOCK DOWN! SO WE DECIDED TO DO A DAILY CHALLENGE TO KEEP YOU GUYS ENTERTAINED!! FIRST CHALLENGE IS THE ""MOST ..."
Sanket Mehta,Quarantine photoshoot challenge | EP 1 | Ft Mr.mnv &amp; Rishabh | Sanket Mehta,80326312,379000,99,400522,42479,223,1449,If you loved this DIY concept and if you're trying this concept upload it on instagram and tag don't forget to mention me in your post @sankett25 insta handles ...
The Daily Student,ABS IN 2 WEEKS?! i tried Chloe ting&#39;s 2 week quarantine SHRED challenge to GLOW UP... i&#39;m SHOOK,1957830023,4730000,197,393224,7683,163,986,Hey guys this is Chloe tings abs in 2 weeks challenge in quarantine to glow up. The results are crazy!! Subscribe: https://bit.ly/3au4b02 Follow my fitness ...
Holly Dolke,Day 2: BEST Arm Workout (Home Workout Challenge),52046655,656000,30,386827,11562,158,1227,DO THE FREE QUIZ TO SEE THE BEST PROGRAM FOR YOU HERE: https://bit.ly/2QHoAX8 ♡ GET YOUR 30 DAY CHALLENGE MEAL PLAN HERE: ...
